{
  "modelId": "TB-WORKLOAD-DAY-V1",
  "modelVersion": "1.0.0",
  "summary": "One business day at a mid-size Polish retail bank: a night trough, a morning ramp, a lunch peak, a second peak as the working day closes, an online cut-off at 20:00, the overnight batch, and reconciliation before the branches open.",

  "realTime": {
    "dailyEventCount": 21588000,
    "peakToTroughRatio": 32.0
  },

  "calendar": {
    "diurnal": [
      0.10, 0.06, 0.05, 0.05, 0.06, 0.10,
      0.22, 0.48, 0.85, 1.20, 1.40, 1.45,
      1.60, 1.50, 1.35, 1.30, 1.35, 1.50,
      1.45, 1.25, 0.90, 0.55, 0.30, 0.16
    ],

    "weekday": {
      "monday": 1.15,
      "tuesday": 1.05,
      "wednesday": 1.00,
      "thursday": 1.02,
      "friday": 1.20,
      "saturday": 0.45,
      "sunday": 0.30
    },

    "payday": {
      "daysOfMonth": [10, 25],
      "multiplier": 1.60
    },

    "monthEnd": {
      "lastDays": 2,
      "multiplier": 1.35
    },

    "windows": [
      {
        "id": "overnight-batch",
        "startMinute": 1230,
        "endMinute": 300,
        "purpose": "EODCYCLE runs against the movement file the online day produced. Wraps midnight, which is why endMinute is not after startMinute."
      },
      {
        "id": "morning-reconciliation",
        "startMinute": 300,
        "endMinute": 420,
        "purpose": "batch/recon compares the account master the cycle wrote against the ledger, and the back office works whatever it found before the branches open."
      },
      {
        "id": "branch-hours",
        "startMinute": 540,
        "endMinute": 1080,
        "purpose": "Staffed hours. Named so a driver can report separately on demand an operator was present for."
      }
    ],

    "instants": [
      {
        "id": "online-cut-off",
        "atMinute": 1200,
        "purpose": "20:00. The moment the online day stops feeding the batch. This is a point on the demand curve and NOT the reconciliation cut-off, which ADR 0015 defines as the set of MOV-TRANSFER-REF values in the movement file rather than as any time of day."
      }
    ]
  },

  "population": {
    "size": 1200000,
    "accountsPerCustomer": 2,

    "cohorts": [
      {
        "id": "retail",
        "share": 0.80,
        "eventsPerCustomerPerDay": 15,
        "amount": {
          "medianMinor": 12000,
          "sigma": 1.1,
          "minMinor": 100,
          "maxMinor": 5000000
        },
        "currencyMix": {
          "PLN": 0.96,
          "EUR": 0.03,
          "USD": 0.01
        },
        "operationMix": {
          "getAccount": 0.06,
          "getBalance": 0.44,
          "getStatement": 0.18,
          "createTransfer": 0.22,
          "getTransfer": 0.06,
          "listHolds": 0.02,
          "placeHold": 0.01,
          "releaseHold": 0.01
        }
      },
      {
        "id": "retail-affluent",
        "share": 0.13,
        "eventsPerCustomerPerDay": 25,
        "amount": {
          "medianMinor": 45000,
          "sigma": 1.2,
          "minMinor": 100,
          "maxMinor": 20000000
        },
        "currencyMix": {
          "PLN": 0.88,
          "EUR": 0.07,
          "USD": 0.03,
          "GBP": 0.02
        },
        "operationMix": {
          "getAccount": 0.05,
          "getBalance": 0.39,
          "getStatement": 0.20,
          "createTransfer": 0.24,
          "getTransfer": 0.06,
          "listHolds": 0.03,
          "placeHold": 0.02,
          "captureHold": 0.01
        }
      },
      {
        "id": "small-business",
        "share": 0.055,
        "eventsPerCustomerPerDay": 40,
        "amount": {
          "medianMinor": 180000,
          "sigma": 1.3,
          "minMinor": 500,
          "maxMinor": 50000000
        },
        "currencyMix": {
          "PLN": 0.90,
          "EUR": 0.07,
          "USD": 0.03
        },
        "operationMix": {
          "getAccount": 0.04,
          "getBalance": 0.28,
          "getStatement": 0.22,
          "createTransfer": 0.34,
          "getTransfer": 0.05,
          "listHolds": 0.03,
          "placeHold": 0.02,
          "captureHold": 0.01,
          "releaseHold": 0.01
        }
      },
      {
        "id": "corporate",
        "share": 0.015,
        "eventsPerCustomerPerDay": 36,
        "amount": {
          "medianMinor": 1250000,
          "sigma": 1.4,
          "minMinor": 10000,
          "maxMinor": 500000000
        },
        "currencyMix": {
          "PLN": 0.72,
          "EUR": 0.16,
          "USD": 0.08,
          "GBP": 0.03,
          "CHF": 0.01
        },
        "operationMix": {
          "getAccount": 0.03,
          "getBalance": 0.17,
          "getStatement": 0.24,
          "createTransfer": 0.42,
          "getTransfer": 0.06,
          "listHolds": 0.03,
          "placeHold": 0.02,
          "captureHold": 0.02,
          "reverseTransfer": 0.01
        }
      }
    ]
  }
}
